<?xml version="1.0" encoding="UTF-8"?>

<scriptChain xmlns="RunnerPyzza"
  xmlns:xsi="http://www.w3.org/2001/XMLSchema-instance"
  xsi:schemaLocation="RunnerPyzza Launcher.xsd">
  <program>
    <main>
      <name>List directory</name>
      <baseCommand>date</baseCommand>
      <order>0</order>
    </main>
    <option>
      <alias></alias>
      <value> </value>
      <separator></separator>
      <delimiter></delimiter>
    </option>
  </program>
  <program>
    <main>
      <name>List directory</name>
      <baseCommand>rm emilio.test</baseCommand>
      <order>0</order>
    </main>
    <option>
      <alias></alias>
      <value> </value>
      <separator></separator>
      <delimiter></delimiter>
    </option>
  </program>
  <program>
    <main>
      <name>List directory</name>
      <baseCommand>ls emilio.test</baseCommand>
      <order>1</order>
    </main>
    <option>
      <alias></alias>
      <value> </value>
      <separator></separator>
      <delimiter></delimiter>
    </option>
  </program>
  <program>
    <main>
      <name>List directory</name>
      <baseCommand>touch emilio.test</baseCommand>
      <order>2</order>
    </main>
    <option>
      <alias></alias>
      <value> </value>
      <separator></separator>
      <delimiter></delimiter>
    </option>
  </program>
    <program>
    <main>
      <name>List directory</name>
      <baseCommand>ls emilio.test</baseCommand>
      <order>3</order>
    </main>
    <option>
      <alias></alias>
      <value> </value>
      <separator></separator>
      <delimiter></delimiter>
    </option>
  </program>
</scriptChain>
